{
  "sample_set_id": "sset_1999b1dbf7dafa4e",
  "members_hash": "sha256:1999b1dbf7dafa4e330add0d0de5c1dfefb156596165ef0c1fa0a4f77d1fa311",
  "n_members": 222,
  "members": [
    "CGA001",
    "CGA002",
    "CGA003",
    "CGA004",
    "CGA005",
    "CGA006",
    "CGA007",
    "CGA008",
    "CGA009",
    "CGA010",
    "CGA011",
    "CGA012",
    "CGA013",
    "CGA014",
    "CGA015",
    "CGA016",
    "CGA017",
    "CGA018",
    "CGA019",
    "CGA020",
    "CGA021",
    "CGA022",
    "CGA023",
    "CGA024",
    "CGA025",
    "CGA026",
    "CGA027",
    "CGA028",
    "CGA029",
    "CGA030",
    "CGA031",
    "CGA032",
    "CGA033",
    "CGA034",
    "CGA035",
    "CGA036",
    "CGA037",
    "CGA038",
    "CGA039",
    "CGA040",
    "CGA041",
    "CGA043",
    "CGA044",
    "CGA045",
    "CGA046",
    "CGA047",
    "CGA048",
    "CGA049",
    "CGA050",
    "CGA051",
    "CGA052",
    "CGA053",
    "CGA054",
    "CGA055",
    "CGA056",
    "CGA057",
    "CGA058",
    "CGA059",
    "CGA060",
    "CGA061",
    "CGA062",
    "CGA063",
    "CGA064",
    "CGA065",
    "CGA066",
    "CGA067",
    "CGA068",
    "CGA069",
    "CGA070",
    "CGA071",
    "CGA072",
    "CGA073",
    "CGA074",
    "CGA075",
    "CGA076",
    "CGA077",
    "CGA078",
    "CGA079",
    "CGA080",
    "CGA081",
    "CGA082",
    "CGA083",
    "CGA084",
    "CGA085",
    "CGA086",
    "CGA087",
    "CGA088",
    "CGA089",
    "CGA090",
    "CGA091",
    "CGA092",
    "CGA093",
    "CGA094",
    "CGA095",
    "CGA096",
    "CGA097",
    "CGA098",
    "CGA099",
    "CGA100",
    "CGA101",
    "CGA102",
    "CGA103",
    "CGA104",
    "CGA105",
    "CGA106",
    "CGA107",
    "CGA108",
    "CGA109",
    "CGA110",
    "CGA111",
    "CGA112",
    "CGA113",
    "CGA114",
    "CGA115",
    "CGA116",
    "CGA117",
    "CGA118",
    "CGA119",
    "CGA120",
    "CGA121",
    "CGA122",
    "CGA123",
    "CGA124",
    "CGA125",
    "CGA126",
    "CGA127",
    "CGA128",
    "CGA129",
    "CGA130",
    "CGA131",
    "CGA132",
    "CGA133",
    "CGA134",
    "CGA135",
    "CGA136",
    "CGA137",
    "CGA138",
    "CGA139",
    "CGA140",
    "CGA141",
    "CGA142",
    "CGA143",
    "CGA144",
    "CGA145",
    "CGA146",
    "CGA147",
    "CGA148",
    "CGA149",
    "CGA150",
    "CGA151",
    "CGA152",
    "CGA153",
    "CGA154",
    "CGA155",
    "CGA156",
    "CGA157",
    "CGA158",
    "CGA159",
    "CGA160",
    "CGA161",
    "CGA162",
    "CGA163",
    "CGA164",
    "CGA165",
    "CGA166",
    "CGA167",
    "CGA168",
    "CGA169",
    "CGA170",
    "CGA171",
    "CGA172",
    "CGA173",
    "CGA174",
    "CGA175",
    "CGA176",
    "CGA177",
    "CGA178",
    "CGA179",
    "CGA180",
    "CGA181",
    "CGA182",
    "CGA183",
    "CGA184",
    "CGA185",
    "CGA186",
    "CGA187",
    "CGA188",
    "CGA190",
    "CGA191",
    "CGA193",
    "CGA194",
    "CGA195",
    "CGA196",
    "CGA197",
    "CGA198",
    "CGA199",
    "CGA200",
    "CGA201",
    "CGA202",
    "CGA203",
    "CGA205",
    "CGA206",
    "CGA207",
    "CGA208",
    "CGA209",
    "CGA210",
    "CGA211",
    "CGA212",
    "CGA213",
    "CGA214",
    "CGA215",
    "CGA216",
    "CGA217",
    "CGA218",
    "CGA219",
    "CGA220",
    "CGA221",
    "CGA222",
    "CGA223",
    "CGA224",
    "CGA225",
    "CGA226"
  ],
  "derived_from": {
    "op": "difference",
    "parents": [
      "ALL",
      "family_F042"
    ],
    "predicate": null
  },
  "cohort_id": "main_226_hatchery",
  "label": "ALL \\ family_F042 (unrelateds)",
  "created_at": "2026-05-12T08:10:00Z"
}